{
  "report_id": "rpt_demo_001",
  "tier": "basic",
  "nickname": "小圓",
  "birth_date": "1993-07-12",
  "birth_time": null,
  "time_unknown": true,
  "focus": "工作",
  "disclaimer": "本結果僅供娛樂與自我反思，不作為醫療、法律、財務、投資或重大人生決策依據。",
  "overall": "（未知時辰，準確度較低）這段時間適合先整理已有能力與成果，而不是一次做大變動。",
  "work": "工作上較需要『可被看見的小成果』，而不是更多靈感。",
  "relationship": "合作時把範圍講清楚，會比加更多承諾更有幫助。",
  "action": "先完成一件能展示的小交付。",
  "locked_fields": ["action_plan", "path_compare", "rationale"]
}
